Question,Answer
How can I use Zoom to take attendance?,"Meeting hosts can run a report post meeting to get a list of people who joined by name, email, and when they entered/exited the meeting. Note: typically the report is not available until ~24hours after the meeting. Here’s how to get the attendance report: Sign into the Georgetown Zoom web portal. Click ‘Reports’ from the navigation menu on the left. Select to run a ‘Usage’ report. Enter the date range of the meeting. Locate the correct meeting, and then click on the blue hyperlinked number under the Participants column. You will now see your meeting’s attendance report. If you wish, you can press the blue Export button to download this information to your computer as a CSV file."
How do I get an audio transcript of the meeting?,"Recordings made using the Zoom cloud option will automatically transcribe the audio of a meeting into text. After the meeting the transcript is processed, and will appear to people watching the recording using the Zoom cloud. The transcript can edited by the host using the Zoom cloud. It can also be downloaded by the host and will appear a .vtt text file on their computer. See Zoom’s guide on how to use audio transcription for cloud recordings."
Are audio transcripts available for local recordings?,"Unfortunately, only Zoom cloud recordings include this feature."
How do I use Virtual Backgrounds in Zoom?,Virtual Background feature allows you to display an image or video as your background during a Zoom Meeting. See Zoom’s guide on how to use virtual backgrounds.
Why can’t I get virtual background to work on my computer?,"This feature works best with a physical green screen and uniform lighting to allow Zoom to detect the difference between you and your background. However, some computers may not meet the minimum specifications to run virtual backgrounds correctly. See Zoom’s guide on system requirements for Virtual Backgrounds."
Where can I get Georgetown themed Virtual Backgrounds for Zoom?,The communications team has shared a number of Georgetown themed Zoom backgrounds that all employees can download.
What are the best practices for Webinars?,"There is no waiting room for webinars, per se, but there is a Practice Session that can be enabled in the initial webinar settings. In Practice Session, Panelists and Hosts can join the webinar and interact with each other; regular attendees cannot join. They see a basic holding message with the webinar title saying it has not started yet. Then, two-to-four minutes before the event start time, the Host should click the Broadcast button to “raise the curtain”. Attendees will start to connect, though not all at once. That’s why you should allow a few minutes for attendees to connect. During this connection period, those attendees who connected first will be able to hear any open panelist/host mics and see the last active speaker camera. At this time, we recommend all panelists and hosts mute themselves. Also, sharing one’s screen and showing a “welcome slide” is helpful for newly connected attendees understand what’s happening, and let them know there will be silence until the event starts."
"When scheduling a webinar under Georgetown zoom account, can we add an Alternative Host from another organization?","You can only add Alternative hosts that have Georgetown licensed Zoom Pro accounts. Alumni and former employees have ‘basic’ or unpaid accounts. This means that you can only assign someone with an active NetID@georgetown.edu account, and not someone with any other type of account. However, you are able to invite anyone you like as an attendee, and once they are in the meeting, you can elevate them to host or co-host. This cannot be done prior to the meeting."
Can I host a Zoom webinar and Zoom meeting at the same time?,"Unfortunately, you CANNOT host 1 meeting and 1 webinar at the same time."
Where can I find more information about how to hold my own Zoom webinars?,"See our guide on Zoom Webinars at Georgetown. Web client What is the Zoom web client and when should I use it? The Zoom web client can help users who are limited in what they can install or download on their computer or devices, allowing them to use their web browser to join Zoom meetings without downloading or updating the software (desktop client) or mobile app. Note: Only use the Zoom web client if you are unable to download or update the Zoom software (desktop client) or mobile app as there are in-meeting limitations with the Zoom web client. You may receive the option to use the Zoom web client “Join from browser” if you have not updated your Zoom software to the latest version after November 5th, 2022. What are the limitations of the Zoom web client (web browser)? The Zoom web client has limited features and functions best on Google Chrome and Mozilla Firefox. Safari: Joining computer audio is not supported Safari: Screen sharing is not supported Edge: Screen sharing requires Windows 10 Pro or Enterprise Internet Explorer (IE): not supported Mobile versions of web browsers (iOS and Android): not supported Local recordings: not supported Annotate on shared screen or whiteboard: not supported See Zoom’s official support page for the full detailed list of features available in the web client. How to join a meeting using the Zoom web client (web browser)? How to start or join meetings and webinars with the web client How to use the web client while in a meeting"
How do I invite a guest speaker outside of Georgetown to my Zoom Conferencing meeting in Canvas?,To invite guests speakers who are not enrolled in your Canvas course or not associated with Georgetown: Login to Canvas and go to the course where you’ve scheduled the meeting. Click on the Zoom Conferencing tool. Mouse over the meeting name/topic and click the “down arrow” that appears. Click ‘Open in Zoom Site’. Locate the “Join URL”‘ on the page and either manually copy/paste the meeting link in an email to your guest; or click the ‘Copy Invitation’ and then paste it in an email to your guest.
"The Zoom meeting disappearing in my Canvas course, how do I get it back?","This can happen when the meeting hosts edits the meeting name using the Zoom web portal. Specifically, removing the course ID (e.g. ENGL-101-01.Fal2020) from the meeting name using the Zoom web portal will break the connection between Zoom and Canvas. Simply adding the course ID back into the meeting name/topic using the Zoom web portal will restore the meeting in the Zoom Conferencing tool in Canvas. If you need to editing the meeting name/topic, use the Zoom Conferencing tool in Canvas. Simply, mouse over the meeting name/topic and click the “down arrow” that appears, then click ‘Edit’. Changes to the meeting name/topic using the Zoom Conferencing tool in Canvas will NOT break the connection."
When I click on Zoom Conferencing in my Canvas course I get an error message — How do I fix it?,"First, try another web browser. Often times your preferred web browser is blocking cookies, which are required to run third-party tools (like Zoom) within your Canvas course. If switching to a different browser does not resolve the problem, try updating your operating system. There are known problems with Mac OS 10.11 and 10.12."
Which Zoom Conferencing option should I choose in my Canvas course site?,See our Zoom Conferencing guide for information on selecting the right meeting type for you Canvas course.
"When a TA or co-instructor creates a meeting using the Zoom Conferencing tool in Canvas, whose Zoom account is associated with that course meeting?","The user who creates a meeting using the Zoom Conferencing tool in Canvas is considered the host of the meeting, and all their Zoom meeting setting preferences apply. For example, if a TA creates a course meeting they will be the meeting host and their meeting preferences are applicable to the course meeting. What’s more, even if the TA adds the instructor(s) as an alternative host to the meeting all cloud recordings associated with the meeting will be “owned” by the original meeting host. Meaning, even if TA never shows up to the meeting, nor technically presses the cloud recording button during the meeting, that TA will still receive the Zoom email with the cloud recording link and not the alternative host. We typically recommend the primary instructor create the course meeting(s) using the Zoom Conferencing tool in Canvas."